{
  "schema_version": 1,
  "review": {
    "id": "REV-INTEGRATIVE-DEMO",
    "title": "Synthetic integrative review",
    "review_type": "integrative",
    "method_rationale": "Integration fits the demonstration of contrasting mechanisms and a proposed framework.",
    "review_type_details": {
      "integration_purpose": "Combine invented supportive and counter-positions.",
      "source_diversity": "Two synthetic conceptual perspectives.",
      "framework_contribution": "An illustrative mechanism-contingent feedback model."
    },
    "status": "complete",
    "purpose": "Demonstrate concept-centric integration with counterevidence.",
    "questions": [
      "How can contrasting mechanisms be retained in a synthetic framework?"
    ],
    "audience": "Plugin reviewers",
    "discipline": "Synthetic demonstration",
    "integrity_policy": "Synthetic fixtures must not be presented as real research.",
    "coverage_limitations": [
      "Two invented sources; no real-world or comprehensive coverage."
    ],
    "stopping_rule": "Stop after both invented perspectives exercise support and contradiction.",
    "checks": {
      "counterevidence": true,
      "rival_explanations": true,
      "boundary_conditions": true,
      "seminal_work": true,
      "recent_work": true,
      "gaps": true,
      "stopping_rule_applied": true,
      "coverage_limits_reported": true
    }
  },
  "state_history": [
    {
      "from_status": "none",
      "to_status": "planning",
      "changed_at": "2026-07-30T04:00:00+00:00",
      "changed_by": "fixture-author"
    },
    {
      "from_status": "planning",
      "to_status": "searching",
      "changed_at": "2026-07-30T04:01:00+00:00",
      "changed_by": "fixture-author"
    },
    {
      "from_status": "searching",
      "to_status": "synthesizing",
      "changed_at": "2026-07-30T04:02:00+00:00",
      "changed_by": "fixture-author"
    },
    {
      "from_status": "synthesizing",
      "to_status": "complete",
      "changed_at": "2026-07-30T04:03:00+00:00",
      "changed_by": "fixture-author"
    }
  ],
  "sources": [
    {
      "id": "SRC-INTEGRATIVE-001",
      "metadata_file": "metadata/SRC-INTEGRATIVE-001.json",
      "note_file": "notes/SRC-INTEGRATIVE-001.md",
      "full_text_status": "available",
      "pdf_file": "papers/SRC-INTEGRATIVE-001.pdf",
      "sha256": "cc8884a9fb0279bebf12a48bbd47b328b82db4b9dc8c3feea4d2fe8e37c2582a",
      "bytes": 145,
      "retrieved_at": "2026-07-30T04:05:00+00:00",
      "verification_sources": [
        "fixture-manifest",
        "fixture-note"
      ]
    },
    {
      "id": "SRC-INTEGRATIVE-002",
      "metadata_file": "metadata/SRC-INTEGRATIVE-002.json",
      "note_file": "notes/SRC-INTEGRATIVE-002.md",
      "full_text_status": "available",
      "pdf_file": "papers/SRC-INTEGRATIVE-002.pdf",
      "sha256": "20f2062bdf97b87688dee6d794b2bee2289b19b556c1481f297464d777dfa252",
      "bytes": 150,
      "retrieved_at": "2026-07-30T04:06:00+00:00",
      "verification_sources": [
        "fixture-manifest",
        "fixture-note"
      ]
    }
  ],
  "claims": [
    {
      "id": "CLAIM-INTEGRATIVE-001",
      "statement": "Within the synthetic fixture, useful feedback timing depends on whether uncertainty reduction or reflection is the relevant mechanism.",
      "interpretation_status": "reviewer-interpretation",
      "supporting_source_ids": [
        "SRC-INTEGRATIVE-001"
      ],
      "contradicting_source_ids": [
        "SRC-INTEGRATIVE-002"
      ],
      "qualifications": "The framework is illustrative and has no real-world evidentiary force."
    }
  ],
  "unresolved_issues": [],
  "stage_approvals": [
    {
      "stage": "boundaries",
      "approved_by": "fixture-author"
    }
  ],
  "ai_contributions": [
    {
      "activity": "fixture generation",
      "scope": "synthetic only"
    }
  ],
  "human_verification": [
    {
      "activity": "contract review",
      "reviewer": "fixture-author"
    }
  ]
}
