{
  "schema_version": 1,
  "review": {
    "id": "REV-CHANGE-ME",
    "title": "",
    "review_type": "narrative",
    "method_rationale": "",
    "review_type_details": {
      "search_description": "",
      "evidence_level_approach": "",
      "endpoints": ""
    },
    "status": "planning",
    "purpose": "",
    "questions": [],
    "audience": "",
    "discipline": "",
    "integrity_policy": "unknown",
    "coverage_limitations": [],
    "stopping_rule": "",
    "checks": {
      "counterevidence": false,
      "rival_explanations": false,
      "boundary_conditions": false,
      "seminal_work": false,
      "recent_work": false,
      "gaps": false,
      "stopping_rule_applied": false,
      "coverage_limits_reported": false
    }
  },
  "state_history": [
    {
      "from_status": "none",
      "to_status": "planning",
      "changed_at": "1970-01-01T00:00:00+00:00",
      "changed_by": "initializer"
    }
  ],
  "sources": [],
  "claims": [],
  "unresolved_issues": [],
  "stage_approvals": [],
  "ai_contributions": [],
  "human_verification": []
}
