{
  "schema_version": 1,
  "review": {
    "id": "REV-NARRATIVE-DEMO",
    "title": "Synthetic narrative review",
    "review_type": "narrative",
    "method_rationale": "A contextual narrative account fits the illustrative professional-learning purpose.",
    "review_type_details": {
      "search_description": "One purposively selected invented teaching source.",
      "evidence_level_approach": "Synthetic status is explicit; no real evidence level is claimed.",
      "endpoints": "A concept-centric mechanism statement with stated limits."
    },
    "status": "complete",
    "purpose": "Demonstrate a transparent narrative-review record.",
    "questions": [
      "How can a concept-centric narrative fixture be represented?"
    ],
    "audience": "Plugin reviewers",
    "discipline": "Synthetic demonstration",
    "integrity_policy": "Synthetic fixtures must not be presented as real research.",
    "coverage_limitations": [
      "One invented English-language source; no real-world coverage."
    ],
    "stopping_rule": "Stop after the complete invented fixture has exercised every record surface.",
    "checks": {
      "counterevidence": true,
      "rival_explanations": true,
      "boundary_conditions": true,
      "seminal_work": true,
      "recent_work": true,
      "gaps": true,
      "stopping_rule_applied": true,
      "coverage_limits_reported": true
    }
  },
  "state_history": [
    {
      "from_status": "none",
      "to_status": "planning",
      "changed_at": "2026-07-30T03:55:00+00:00",
      "changed_by": "fixture-author"
    },
    {
      "from_status": "planning",
      "to_status": "searching",
      "changed_at": "2026-07-30T03:56:00+00:00",
      "changed_by": "fixture-author"
    },
    {
      "from_status": "searching",
      "to_status": "synthesizing",
      "changed_at": "2026-07-30T03:57:00+00:00",
      "changed_by": "fixture-author"
    },
    {
      "from_status": "synthesizing",
      "to_status": "complete",
      "changed_at": "2026-07-30T03:58:00+00:00",
      "changed_by": "fixture-author"
    }
  ],
  "sources": [
    {
      "id": "SRC-NARRATIVE-001",
      "metadata_file": "metadata/SRC-NARRATIVE-001.json",
      "note_file": "notes/SRC-NARRATIVE-001.md",
      "full_text_status": "available",
      "pdf_file": "papers/SRC-NARRATIVE-001.pdf",
      "sha256": "947f2495ccf270d43519d4d686059fe61108fb3ee1b879c5b8d4d514faaf9b84",
      "bytes": 157,
      "retrieved_at": "2026-07-30T04:00:00+00:00",
      "verification_sources": [
        "fixture-manifest",
        "fixture-note"
      ]
    }
  ],
  "claims": [
    {
      "id": "CLAIM-NARRATIVE-001",
      "statement": "Within the synthetic fixture, scheduling clarity is treated as a participation mechanism.",
      "interpretation_status": "reviewer-interpretation",
      "supporting_source_ids": [
        "SRC-NARRATIVE-001"
      ],
      "contradicting_source_ids": [],
      "qualifications": "Illustrative synthetic data only; no real-world inference is permitted."
    }
  ],
  "unresolved_issues": [],
  "stage_approvals": [
    {
      "stage": "boundaries",
      "approved_by": "fixture-author"
    }
  ],
  "ai_contributions": [
    {
      "activity": "fixture generation",
      "scope": "synthetic only"
    }
  ],
  "human_verification": [
    {
      "activity": "contract review",
      "reviewer": "fixture-author"
    }
  ]
}
